{
  "schema_version": "0.1.0",
  "batch_id": "batch-2026-05-09-01",
  "created_at": "2026-05-09T14:00:00Z",
  "closed_at": "2026-05-09T15:35:00Z",
  "collector_version": "0.1.0-draft",
  "media_label": "IR-USB-01",
  "operator_id": "op-jdoe",
  "notes": "Sample batch showing two systems collected before return to hub.",
  "cases": [
    {
      "bundle_id": "bundle-ws23-20260509-140500z",
      "case_id": "CASE-2026-0509-001",
      "hostname": "WS-23",
      "relative_path": "case-WS-23-2026-05-09T140500Z",
      "collected_at": "2026-05-09T14:05:00Z",
      "status": "ok"
    },
    {
      "bundle_id": "bundle-finlt07-20260509-151700z",
      "case_id": "CASE-2026-0509-002",
      "hostname": "FIN-LT-07",
      "relative_path": "case-FIN-LT-07-2026-05-09T151700Z",
      "collected_at": "2026-05-09T15:17:00Z",
      "status": "partial"
    }
  ]
}
